{
  "$schema": "../../packages/schema/schemas/media-identity.schema.json",
  "schema": "media-identity/v2",
  "id": "media-000087",
  "kind": "anime",
  "series_id": "series-000083",
  "title": "元祖！バンドリちゃん",
  "installment": {},
  "provider_refs": [
    {
      "entity": "subject",
      "id": "540449",
      "provider": "bangumi"
    }
  ],
  "relationships": []
}
