{
  "$schema": "../../packages/schema/schemas/media-identity.schema.json",
  "schema": "media-identity/v2",
  "id": "media-000084",
  "kind": "anime",
  "series_id": "series-000081",
  "title": "最強出涸らし皇子の暗躍帝位争い",
  "installment": {},
  "provider_refs": [
    {
      "entity": "subject",
      "id": "456081",
      "provider": "bangumi"
    }
  ],
  "relationships": []
}
