{
  "$schema": "../../packages/schema/schemas/media-identity.schema.json",
  "schema": "media-identity/v2",
  "id": "media-000029",
  "kind": "anime",
  "series_id": "series-000035",
  "title": "悪食令嬢と狂血公爵",
  "installment": {},
  "provider_refs": [
    {
      "entity": "subject",
      "id": "520698",
      "provider": "bangumi"
    }
  ],
  "relationships": []
}
