{
  "$schema": "../../packages/schema/schemas/media-identity.schema.json",
  "schema": "media-identity/v2",
  "id": "media-000041",
  "kind": "anime",
  "series_id": "series-000044",
  "title": "天穂のサクナヒメ ココロワ稲作日誌",
  "installment": {},
  "provider_refs": [
    {
      "entity": "subject",
      "id": "524128",
      "provider": "bangumi"
    }
  ],
  "relationships": []
}
