{
  "$schema": "../../packages/schema/schemas/media-identity.schema.json",
  "schema": "media-identity/v2",
  "id": "media-000078",
  "kind": "anime",
  "series_id": "series-000075",
  "title": "ここは俺に任せて先に行けと言ってから10年がたったら伝説になっていた。",
  "installment": {},
  "provider_refs": [
    {
      "entity": "subject",
      "id": "590786",
      "provider": "bangumi"
    }
  ],
  "relationships": []
}
