{
  "$schema": "../../packages/schema/schemas/media-identity.schema.json",
  "schema": "media-identity/v2",
  "id": "media-000040",
  "kind": "anime",
  "series_id": "series-000089",
  "title": "ウルトラマンオメガ",
  "installment": {},
  "provider_refs": [
    {
      "entity": "subject",
      "id": "546258",
      "provider": "bangumi"
    }
  ],
  "relationships": []
}
