{
  "$schema": "../../packages/schema/schemas/media-identity.schema.json",
  "schema": "media-identity/v2",
  "id": "media-000039",
  "kind": "anime",
  "series_id": "series-000088",
  "title": "仮面ライダーゼッツ",
  "installment": {},
  "provider_refs": [
    {
      "entity": "subject",
      "id": "545304",
      "provider": "bangumi"
    }
  ],
  "relationships": []
}
