{
  "$schema": "../../packages/schema/schemas/media-identity.schema.json",
  "schema": "media-identity/v2",
  "id": "media-000026",
  "kind": "anime",
  "series_id": "series-000032",
  "title": "これ描いて死ね",
  "installment": {},
  "provider_refs": [
    {
      "entity": "subject",
      "id": "545917",
      "provider": "bangumi"
    }
  ],
  "relationships": []
}
