{
  "$schema": "../../packages/schema/schemas/media-identity.schema.json",
  "schema": "media-identity/v2",
  "id": "media-000030",
  "kind": "anime",
  "series_id": "series-000036",
  "title": "ただいま、おじゃまされます！",
  "installment": {},
  "provider_refs": [
    {
      "entity": "subject",
      "id": "610703",
      "provider": "bangumi"
    }
  ],
  "relationships": []
}
