{
  "$schema": "../../packages/schema/schemas/media-identity.schema.json",
  "schema": "media-identity/v2",
  "id": "media-000027",
  "kind": "anime",
  "series_id": "series-000033",
  "title": "グノーシア",
  "installment": {},
  "provider_refs": [
    {
      "entity": "subject",
      "id": "526448",
      "provider": "bangumi"
    }
  ],
  "relationships": []
}
