{
  "$schema": "../../packages/schema/schemas/media-identity.schema.json",
  "schema": "media-identity/v2",
  "id": "media-000050",
  "kind": "anime",
  "series_id": "series-000050",
  "title": "女神『異世界転生何になりたいですか』俺「勇者の肋骨で」",
  "installment": {},
  "provider_refs": [
    {
      "entity": "subject",
      "id": "623854",
      "provider": "bangumi"
    }
  ],
  "relationships": []
}
