{
  "$schema": "../../packages/schema/schemas/media-identity.schema.json",
  "schema": "media-identity/v2",
  "id": "media-000064",
  "kind": "anime",
  "series_id": "series-000064",
  "title": "Re:ゼロから始める異世界生活",
  "installment": {},
  "provider_refs": [
    {
      "entity": "subject",
      "id": "140001",
      "provider": "bangumi"
    }
  ],
  "relationships": []
}
